{
  "quantityIds": [],
  "period": {
    "from": "2025-09-06",
    "to": "2025-09-27"
  },
  "source": {
    "datasetId": "ds-kto-visitors-15101972",
    "title": "한국관광공사_빅데이터_지역별 방문자수_GW",
    "publisher": "한국관광공사",
    "datalabMenu": "빅데이터 > 지역별 방문자수(이동통신)",
    "accessUrl": "https://www.data.go.kr/data/15101972/openapi.do"
  },
  "availableAt": "2025-10-01",
  "ruleId": null,
  "clauseId": null,
  "caseEventId": null,
  "assumptionId": null,
  "forecastId": null,
  "modelVersion": null,
  "checkResult": null,
  "id": "ev-baseline-28110",
  "kind": "data",
  "title": "인천 중구 평시 토요일 방문",
  "summary": "행사 전 4주 같은 요일 평균"
}
